<?xml version="1.0" encoding="utf-8" ?>
<Datatable xmlns:xsi="http://www.w3.org/2001/XMLSchema-instance" xmlns:xsd="http://www.w3.org/2001/XMLSchema" xsi:noNamespaceSchemaLocation="../Schemas/Amplitude.Unity.Simulation.SimulationDescriptor.xsd">

    <!-- Game speed -->
    <SimulationDescriptor Name="GameSpeedFast" Type="GameSpeed">
        <Modifier TargetProperty="GameSpeedTrendMultiplier"             Operation="Force"           Value="1"/> <!-- modded -->
        <Modifier TargetProperty="GameSpeedMultiplier"                  Operation="Force"           Value=".5"/>
        <Modifier TargetProperty="GameSpeedProductionCostReduction"     Operation="Addition"        Value="0.5"         Priority="-2"   Path="ClassEmpire"/>
        <Modifier TargetProperty="GameSpeedProductionCostReduction"     Operation="Addition"        Value="0.5"         Priority="-2"   Path="ClassEmpire/ClassStarSystem"/>
        <Modifier TargetProperty="EconomicVictoryDustAmountRequired"    Operation="Multiplication"  Value="0.75"        Priority="-2"   Path="ClassEmpire"/>
        <Modifier TargetProperty="GameSpeedPirateTrendMultiplier"       Operation="Force"           Value="1.25"        Priority="-2"   Path="ClassEmpire"/>
        <Modifier TargetProperty="BaseTurnsBeforeFleetSpawn"            Operation="Multiplication"  Value="0.8"                         Path="ClassEmpire"/>
        <Modifier TargetProperty="LastTurn"                             Operation="Multiplication"  Value="0.5"                         Path="ClassEmpire"/>
        <Modifier TargetProperty="NetMinorEmpireMoney"                  Operation="Multiplication"  Value="1.5"         Priority="2"    Path="ClassEmpire,EmpireTypeMinor"/>
        <Modifier TargetProperty="GameSpeedScienceDiplomacy"       Operation="Force"               Value="0.5"        Priority="-2"   Path="ClassEmpire/ClassDiplomacy/ClassDiplomaticEmpire,DiplomaticAbilityEffectScienceAgreement"/>
        <Modifier TargetProperty="FactionPactDuration"                  Operation="Multiplication"  Value="0.5"         Priority="-2"   Path="ClassEmpire/ClassDiplomacy/ClassDiplomaticEmpire,FactionPact"/>
        <Modifier TargetProperty="HealthRegenerationRatio"              Operation="Multiplication"  Value="1.5"                         Path="ClassEmpire/ClassGarrison/ClassShip" Priority="10" />
        <Modifier TargetProperty="GameSpeedHackMultiplier"              Operation="Force"           Value="1.25"                        Path="ClassEmpire"/>
        <Modifier TargetProperty="GameSpeedMinorPirateHackingStartMultiplier"                  Operation="Force"           Value=".5"/>
        <Modifier TargetProperty="PressureTrend"                        Operation="Multiplication"  Value="$(GameSpeedTrendMultiplier)" Path="ClassEmpire/ClassDiplomacy/ClassDiplomaticEmpire"/>
    </SimulationDescriptor>

</Datatable>